{"$id":"urn:securelinux-policy-v3:apply-semantic-contract:v2","$schema":"https://json-schema.org/draft/2020-12/schema","additionalProperties":false,"properties":{"apply_kind":{"pattern":"^[a-z0-9][a-z0-9._-]*$","type":"string"},"authority_form":{"const":"MECHANISM_AUTHORITY_V1"},"check_contract_id":{"minLength":1,"type":"string"},"concurrency":{"additionalProperties":false,"properties":{"exclusive_lock":{"pattern":"^[A-Z0-9_]+$","type":"string"},"reread_under_lock":{"const":true},"stale_prestate":{"const":"ABORT_NO_MUTATION"}},"required":["exclusive_lock","reread_under_lock","stale_prestate"],"type":"object"},"contract_class":{"const":"APPLY"},"control_id":{"minLength":1,"type":"string"},"control_ids":{"items":{"minLength":1,"type":"string"},"minItems":1,"type":"array","uniqueItems":true},"donor_mapping":{"items":{"additionalProperties":false,"properties":{"decision":{"enum":["REUSE","ADAPT","REJECT","DEFER"]},"mapping_id":{"minLength":1,"type":"string"},"usage":{"minLength":1,"type":"string"}},"required":["mapping_id","decision","usage"],"type":"object"},"type":"array"},"dry_run":{"additionalProperties":false,"properties":{"host_mutation":{"const":false},"must_report_exact_target_set":{"type":"boolean"},"required":{"type":"boolean"}},"required":["required","host_mutation","must_report_exact_target_set"],"type":"object"},"forbidden":{"items":{"minLength":1,"type":"string"},"type":"array","uniqueItems":true},"mechanism_id":{"pattern":"^[a-z0-9][a-z0-9._-]*$","type":"string"},"mutation":{"oneOf":[{"additionalProperties":false,"properties":{"allowed_paths":{"items":{"pattern":"^/","type":"string"},"minItems":1,"type":"array","uniqueItems":true},"mutation_class":{"const":"FILE_CONTENT"},"no_generated_secret":{"type":"boolean"},"preserve_present_security_metadata":{"const":true},"preserve_unrelated_bytes":{"const":true},"transform_id":{"pattern":"^[a-z0-9][a-z0-9._-]*$","type":"string"}},"required":["allowed_paths","transform_id","preserve_unrelated_bytes","preserve_present_security_metadata","no_generated_secret"],"type":"object"},{"additionalProperties":false,"properties":{"allowed_paths":{"items":{"pattern":"^/","type":"string"},"minItems":1,"type":"array","uniqueItems":true},"final_object_required":{"enum":["REGULAR_FILE"]},"metadata_fields":{"items":{"enum":["mode"]},"minItems":1,"type":"array","uniqueItems":true},"mutation_class":{"const":"FILE_METADATA"},"mutation_direction":{"const":"RESTRICT_ONLY"},"preserve_content":{"const":true},"preserve_ownership":{"const":true},"preserve_present_security_metadata":{"const":true},"single_link_required":{"const":true},"syscall":{"enum":["fchmod"]}},"required":["mutation_class","allowed_paths","metadata_fields","syscall","mutation_direction","final_object_required","single_link_required","preserve_content","preserve_ownership","preserve_present_security_metadata"],"type":"object"}]},"postcondition":{"additionalProperties":false,"properties":{"current_check_required":{"const":true},"idempotent_reapply":{"const":"NO_MUTATION"},"required_compliance":{"const":"PASS"}},"required":["current_check_required","required_compliance","idempotent_reapply"],"type":"object"},"precondition":{"additionalProperties":false,"properties":{"check_error":{"const":"ABORT_NO_MUTATION"},"check_fail":{"const":"ELIGIBLE_FOR_APPLY"},"check_not_found":{"const":"ABORT_NO_MUTATION"},"check_pass":{"const":"NOOP_SUCCESS"}},"required":["check_pass","check_fail","check_error"],"type":"object"},"privilege":{"pattern":"^[A-Z0-9_]+$","type":"string"},"recovery":{"additionalProperties":false,"properties":{"security_weakening_compensation":{"const":"FORBIDDEN"},"successful_apply":{"const":"EXTERNAL_SNAPSHOT"},"user_restore":{"const":false}},"required":["user_restore","successful_apply","security_weakening_compensation"],"type":"object"},"registry_binding":{"additionalProperties":false,"properties":{"adapter_id":{"minLength":1,"type":"string"},"apply_kind":{"minLength":1,"type":"string"},"architecture_id":{"minLength":1,"type":"string"},"authority_path":{"pattern":"^product/contracts/","type":"string"},"binding_contract_id":{"minLength":1,"type":"string"},"composition_contract_id":{"minLength":1,"type":"string"},"legacy_column_semantics":{"type":"object"},"parameter_kind":{"minLength":1,"type":"string"},"target_class":{"minLength":1,"type":"string"}},"required":["apply_kind","parameter_kind","target_class","architecture_id","composition_contract_id","authority_path","legacy_column_semantics","adapter_id","binding_contract_id"],"type":"object"},"revalidation":{"additionalProperties":false,"properties":{"before_each_syscall":{"const":true},"drift_before_mutation":{"const":"ABORT_NO_MUTATION"},"fields":{"items":{"enum":["st_dev","st_ino","st_nlink","file_type","uid","gid","mode","content_sha256","filesystem_read_only"]},"minItems":1,"type":"array","uniqueItems":true},"object_binding":{"const":"OPEN_FD_NOFOLLOW"}},"required":["before_each_syscall","object_binding","fields","drift_before_mutation"],"type":"object"},"semantic_contract_id":{"pattern":"^[a-z0-9][a-z0-9._-]*$","type":"string"},"semantic_contract_version":{"minimum":1,"type":"integer"},"source_row":{"pattern":"^SRC-[0-9]{4}$","type":"string"},"target_id":{"minLength":1,"type":"string"},"target_selection":{"additionalProperties":false,"properties":{"exact_set_required":{"const":true},"population_authority":{"minLength":1,"type":"string"},"predicate_id":{"pattern":"^[a-z0-9][a-z0-9._-]*$","type":"string"}},"required":["population_authority","predicate_id","exact_set_required"],"type":"object"},"transaction":{"additionalProperties":false,"properties":{"after_mutation_failure":{"enum":["SAFE_TRANSACTION_LOCAL_COMPENSATION","NO_UNSAFE_COMPENSATION_EXTERNAL_RECOVERY"]},"before_commit_failure":{"const":"CLEANUP_TEMP_ONLY"},"commit_model":{"enum":["SINGLE_ATOMIC_FILE_COMMIT","MULTI_STEP_TRANSACTION","SINGLE_METADATA_SYSCALL"]}},"required":["commit_model","before_commit_failure","after_mutation_failure"],"type":"object"}},"required":["semantic_contract_id","semantic_contract_version","contract_class","source_row","target_id","apply_kind","precondition","privilege","target_selection","mutation","concurrency","transaction","postcondition","recovery","dry_run","forbidden","donor_mapping","check_contract_id"],"title":"SecureLinux-Policy APPLY semantic contract v2","type":"object"}
