{"apply_kind":"file-mode-owner-v1","authority_form":"MECHANISM_AUTHORITY_V1","check_contract_id":"file-mode-owner-check-semantic-v2","concurrency":{"exclusive_lock":"FILE_MODE_OWNER_LOCK","reread_under_lock":true,"stale_prestate":"ABORT_NO_MUTATION"},"contract_class":"APPLY","control_ids":["FSTEC-LINUX-2022-2.3.1-GROUP-MODE","FSTEC-LINUX-2022-2.3.1-PASSWD-MODE","FSTEC-LINUX-2022-2.3.1-SHADOW-GO-RWX"],"donor_mapping":[],"dry_run":{"host_mutation":false,"must_report_exact_target_set":true,"required":true},"forbidden":["user-invokable RESTORE","ownership change","content modification","path-based chmod after admission","mode relaxation"],"mechanism_id":"file-mode-owner-v1","mutation":{"allowed_paths":["/etc/group","/etc/passwd","/etc/shadow"],"final_object_required":"REGULAR_FILE","metadata_fields":["mode"],"mutation_class":"FILE_METADATA","mutation_direction":"RESTRICT_ONLY","preserve_content":true,"preserve_ownership":true,"preserve_present_security_metadata":true,"single_link_required":true,"syscall":"fchmod"},"postcondition":{"current_check_required":true,"idempotent_reapply":"NO_MUTATION","required_compliance":"PASS"},"precondition":{"check_error":"ABORT_NO_MUTATION","check_fail":"ELIGIBLE_FOR_APPLY","check_not_found":"ABORT_NO_MUTATION","check_pass":"NOOP_SUCCESS"},"privilege":"ROOT_REQUIRED_FAIL_CLOSED","recovery":{"security_weakening_compensation":"FORBIDDEN","successful_apply":"EXTERNAL_SNAPSHOT","user_restore":false},"registry_binding":{"adapter_id":"product-file-mode-owner-apply-v1","apply_kind":"file-mode-owner-v1","architecture_id":"file-mode-owner-v1","authority_path":"product/contracts/mechanism-file-mode-owner-v1.json","binding_contract_id":"product-file-mode-owner-apply-binding-v1","composition_contract_id":"file-mode-owner-v1","legacy_column_semantics":{"architecture_id":"Для MECHANISM_AUTHORITY_V1 идентифицирует единый mechanism-authority document, а не отдельный architecture document.","architecture_path":"Для MECHANISM_AUTHORITY_V1 указывает непосредственно на единый mechanism-authority document.","composition_contract_id":"Для MECHANISM_AUTHORITY_V1 совпадает с identity той же authority; отдельный composition document отсутствует.","composition_contract_path":"Binding JSON для MECHANISM_AUTHORITY_V1 указывает на тот же mechanism-authority document."},"parameter_kind":"file-mode-owner","target_class":"file-mode-fixed-path"},"revalidation":{"before_each_syscall":true,"drift_before_mutation":"ABORT_NO_MUTATION","fields":["st_dev","st_ino","st_nlink","file_type","uid","gid","mode","filesystem_read_only"],"object_binding":"OPEN_FD_NOFOLLOW"},"semantic_contract_id":"file-mode-owner-apply-semantic-v1","semantic_contract_version":1,"source_row":"SRC-0005","target_id":"linux-x86_64-supported-v1","target_selection":{"exact_set_required":true,"population_authority":"current CHECK semantic file-mode-owner-check-semantic-v2","predicate_id":"mode-noncompliant"},"transaction":{"after_mutation_failure":"NO_UNSAFE_COMPENSATION_EXTERNAL_RECOVERY","before_commit_failure":"CLEANUP_TEMP_ONLY","commit_model":"SINGLE_METADATA_SYSCALL"}}
